No.     Time           Source                Destination           Protocol Length Info
      3 1.844282       31.13.92.10           192.168.1.44          TLSv1.2  312    Application Data

Frame 3: 312 bytes on wire (2496 bits), 312 bytes captured (2496 bits) on interface 0
Ethernet II, Src: Sagemcom_7e:6c:ee (84:a4:23:7e:6c:ee), Dst: Apple_1d:4a:73 (a0:99:9b:1d:4a:73)
    Destination: Apple_1d:4a:73 (a0:99:9b:1d:4a:73)
    Source: Sagemcom_7e:6c:ee (84:a4:23:7e:6c:ee)
    Type: IPv4 (0x0800)
Internet Protocol Version 4, Src: 31.13.92.10, Dst: 192.168.1.44
Transmission Control Protocol, Src Port: 443, Dst Port: 59313, Seq: 1, Ack: 1, Len: 246
Secure Sockets Layer
    TLSv1.2 Record Layer: Application Data Protocol: http-over-tls
        Content Type: Application Data (23)
        Version: TLS 1.2 (0x0303)
        Length: 241
        Encrypted Application Data: 6b6adfb71475e039210e2b30cd9832595b025473a3cc7e2a...

No.     Time           Source                Destination           Protocol Length Info
      4 1.844365       192.168.1.44          31.13.92.10           TCP      66     59313→443 [ACK] Seq=1 Ack=247 Win=4088 Len=0 TSval=862807169 TSecr=1871688598

Frame 4: 66 bytes on wire (528 bits), 66 bytes captured (528 bits) on interface 0
Ethernet II, Src: Apple_1d:4a:73 (a0:99:9b:1d:4a:73), Dst: Sagemcom_7e:6c:ee (84:a4:23:7e:6c:ee)
    Destination: Sagemcom_7e:6c:ee (84:a4:23:7e:6c:ee)
    Source: Apple_1d:4a:73 (a0:99:9b:1d:4a:73)
    Type: IPv4 (0x0800)
Internet Protocol Version 4, Src: 192.168.1.44, Dst: 31.13.92.10
Transmission Control Protocol, Src Port: 59313, Dst Port: 443, Seq: 1, Ack: 247, Len: 0

No.     Time           Source                Destination           Protocol Length Info
      5 1.856190       192.168.1.44          31.13.92.10           TLSv1.2  511    Application Data

Frame 5: 511 bytes on wire (4088 bits), 511 bytes captured (4088 bits) on interface 0
Ethernet II, Src: Apple_1d:4a:73 (a0:99:9b:1d:4a:73), Dst: Sagemcom_7e:6c:ee (84:a4:23:7e:6c:ee)
    Destination: Sagemcom_7e:6c:ee (84:a4:23:7e:6c:ee)
    Source: Apple_1d:4a:73 (a0:99:9b:1d:4a:73)
    Type: IPv4 (0x0800)
Internet Protocol Version 4, Src: 192.168.1.44, Dst: 31.13.92.10
Transmission Control Protocol, Src Port: 59313, Dst Port: 443, Seq: 1, Ack: 247, Len: 445
Secure Sockets Layer
    TLSv1.2 Record Layer: Application Data Protocol: http-over-tls
        Content Type: Application Data (23)
        Version: TLS 1.2 (0x0303)
        Length: 440
        Encrypted Application Data: 4acf3b33cd586cc3cc2cd4d3bfdf121645c59849639e2c00...

No.     Time           Source                Destination           Protocol Length Info
      6 1.887431       31.13.92.10           192.168.1.44          TLSv1.2  108    Application Data

Frame 6: 108 bytes on wire (864 bits), 108 bytes captured (864 bits) on interface 0
Ethernet II, Src: Sagemcom_7e:6c:ee (84:a4:23:7e:6c:ee), Dst: Apple_1d:4a:73 (a0:99:9b:1d:4a:73)
    Destination: Apple_1d:4a:73 (a0:99:9b:1d:4a:73)
    Source: Sagemcom_7e:6c:ee (84:a4:23:7e:6c:ee)
    Type: IPv4 (0x0800)
Internet Protocol Version 4, Src: 31.13.92.10, Dst: 192.168.1.44
Transmission Control Protocol, Src Port: 443, Dst Port: 59313, Seq: 247, Ack: 446, Len: 42
Secure Sockets Layer
    TLSv1.2 Record Layer: Application Data Protocol: http-over-tls
        Content Type: Application Data (23)
        Version: TLS 1.2 (0x0303)
        Length: 37
        Encrypted Application Data: 6b6adfb71475e03acbe709c3c87137b6e6943c5b8fdcc881...

No.     Time           Source                Destination           Protocol Length Info
      7 1.887503       192.168.1.44          31.13.92.10           TCP      66     59313→443 [ACK] Seq=446 Ack=289 Win=4094 Len=0 TSval=862807210 TSecr=1871688695

Frame 7: 66 bytes on wire (528 bits), 66 bytes captured (528 bits) on interface 0
Ethernet II, Src: Apple_1d:4a:73 (a0:99:9b:1d:4a:73), Dst: Sagemcom_7e:6c:ee (84:a4:23:7e:6c:ee)
    Destination: Sagemcom_7e:6c:ee (84:a4:23:7e:6c:ee)
    Source: Apple_1d:4a:73 (a0:99:9b:1d:4a:73)
    Type: IPv4 (0x0800)
Internet Protocol Version 4, Src: 192.168.1.44, Dst: 31.13.92.10
Transmission Control Protocol, Src Port: 59313, Dst Port: 443, Seq: 446, Ack: 289, Len: 0

No.     Time           Source                Destination           Protocol Length Info
      8 3.379773       31.13.92.10           192.168.1.44          TLSv1.2  312    Application Data

Frame 8: 312 bytes on wire (2496 bits), 312 bytes captured (2496 bits) on interface 0
Ethernet II, Src: Sagemcom_7e:6c:ee (84:a4:23:7e:6c:ee), Dst: Apple_1d:4a:73 (a0:99:9b:1d:4a:73)
    Destination: Apple_1d:4a:73 (a0:99:9b:1d:4a:73)
    Source: Sagemcom_7e:6c:ee (84:a4:23:7e:6c:ee)
    Type: IPv4 (0x0800)
Internet Protocol Version 4, Src: 31.13.92.10, Dst: 192.168.1.44
Transmission Control Protocol, Src Port: 443, Dst Port: 59313, Seq: 289, Ack: 446, Len: 246
Secure Sockets Layer
    TLSv1.2 Record Layer: Application Data Protocol: http-over-tls
        Content Type: Application Data (23)
        Version: TLS 1.2 (0x0303)
        Length: 241
        Encrypted Application Data: 6b6adfb71475e03b55d358dfec696eeba57e2db7e2e855c9...

No.     Time           Source                Destination           Protocol Length Info
      9 3.379852       192.168.1.44          31.13.92.10           TCP      66     59313→443 [ACK] Seq=446 Ack=535 Win=4088 Len=0 TSval=862808698 TSecr=1871689621

Frame 9: 66 bytes on wire (528 bits), 66 bytes captured (528 bits) on interface 0
Ethernet II, Src: Apple_1d:4a:73 (a0:99:9b:1d:4a:73), Dst: Sagemcom_7e:6c:ee (84:a4:23:7e:6c:ee)
    Destination: Sagemcom_7e:6c:ee (84:a4:23:7e:6c:ee)
    Source: Apple_1d:4a:73 (a0:99:9b:1d:4a:73)
    Type: IPv4 (0x0800)
Internet Protocol Version 4, Src: 192.168.1.44, Dst: 31.13.92.10
Transmission Control Protocol, Src Port: 59313, Dst Port: 443, Seq: 446, Ack: 535, Len: 0

No.     Time           Source                Destination           Protocol Length Info
     10 3.380792       31.13.92.10           192.168.1.44          TLSv1.2  312    [TCP Spurious Retransmission] Application Data

Frame 10: 312 bytes on wire (2496 bits), 312 bytes captured (2496 bits) on interface 0
Ethernet II, Src: Sagemcom_7e:6c:ee (84:a4:23:7e:6c:ee), Dst: Apple_1d:4a:73 (a0:99:9b:1d:4a:73)
    Destination: Apple_1d:4a:73 (a0:99:9b:1d:4a:73)
    Source: Sagemcom_7e:6c:ee (84:a4:23:7e:6c:ee)
    Type: IPv4 (0x0800)
Internet Protocol Version 4, Src: 31.13.92.10, Dst: 192.168.1.44
Transmission Control Protocol, Src Port: 443, Dst Port: 59313, Seq: 289, Ack: 446, Len: 246
Secure Sockets Layer
    TLSv1.2 Record Layer: Application Data Protocol: http-over-tls
        Content Type: Application Data (23)
        Version: TLS 1.2 (0x0303)
        Length: 241
        Encrypted Application Data: 6b6adfb71475e03b55d358dfec696eeba57e2db7e2e855c9...

No.     Time           Source                Destination           Protocol Length Info
     11 3.380861       192.168.1.44          31.13.92.10           TCP      78     [TCP Window Update] 59313→443 [ACK] Seq=446 Ack=535 Win=4096 Len=0 TSval=862808699 TSecr=1871689964 SLE=289 SRE=535

Frame 11: 78 bytes on wire (624 bits), 78 bytes captured (624 bits) on interface 0
Ethernet II, Src: Apple_1d:4a:73 (a0:99:9b:1d:4a:73), Dst: Sagemcom_7e:6c:ee (84:a4:23:7e:6c:ee)
    Destination: Sagemcom_7e:6c:ee (84:a4:23:7e:6c:ee)
    Source: Apple_1d:4a:73 (a0:99:9b:1d:4a:73)
    Type: IPv4 (0x0800)
Internet Protocol Version 4, Src: 192.168.1.44, Dst: 31.13.92.10
Transmission Control Protocol, Src Port: 59313, Dst Port: 443, Seq: 446, Ack: 535, Len: 0

No.     Time           Source                Destination           Protocol Length Info
     12 3.383890       192.168.1.44          31.13.92.10           TLSv1.2  510    Application Data

Frame 12: 510 bytes on wire (4080 bits), 510 bytes captured (4080 bits) on interface 0
Ethernet II, Src: Apple_1d:4a:73 (a0:99:9b:1d:4a:73), Dst: Sagemcom_7e:6c:ee (84:a4:23:7e:6c:ee)
    Destination: Sagemcom_7e:6c:ee (84:a4:23:7e:6c:ee)
    Source: Apple_1d:4a:73 (a0:99:9b:1d:4a:73)
    Type: IPv4 (0x0800)
Internet Protocol Version 4, Src: 192.168.1.44, Dst: 31.13.92.10
Transmission Control Protocol, Src Port: 59313, Dst Port: 443, Seq: 446, Ack: 535, Len: 444
Secure Sockets Layer
    TLSv1.2 Record Layer: Application Data Protocol: http-over-tls
        Content Type: Application Data (23)
        Version: TLS 1.2 (0x0303)
        Length: 439
        Encrypted Application Data: 4acf3b33cd586cc450bf8cc938418ef6f8ef7d2e5c21f0f6...

No.     Time           Source                Destination           Protocol Length Info
     13 3.413150       31.13.92.10           192.168.1.44          TLSv1.2  108    Application Data

Frame 13: 108 bytes on wire (864 bits), 108 bytes captured (864 bits) on interface 0
Ethernet II, Src: Sagemcom_7e:6c:ee (84:a4:23:7e:6c:ee), Dst: Apple_1d:4a:73 (a0:99:9b:1d:4a:73)
    Destination: Apple_1d:4a:73 (a0:99:9b:1d:4a:73)
    Source: Sagemcom_7e:6c:ee (84:a4:23:7e:6c:ee)
    Type: IPv4 (0x0800)
Internet Protocol Version 4, Src: 31.13.92.10, Dst: 192.168.1.44
Transmission Control Protocol, Src Port: 443, Dst Port: 59313, Seq: 535, Ack: 890, Len: 42
Secure Sockets Layer
    TLSv1.2 Record Layer: Application Data Protocol: http-over-tls
        Content Type: Application Data (23)
        Version: TLS 1.2 (0x0303)
        Length: 37
        Encrypted Application Data: 6b6adfb71475e03cd1c2efa57b5219dcec461adee29ddc77...

No.     Time           Source                Destination           Protocol Length Info
     14 3.413206       192.168.1.44          31.13.92.10           TCP      66     59313→443 [ACK] Seq=890 Ack=577 Win=4094 Len=0 TSval=862808730 TSecr=1871690221

Frame 14: 66 bytes on wire (528 bits), 66 bytes captured (528 bits) on interface 0
Ethernet II, Src: Apple_1d:4a:73 (a0:99:9b:1d:4a:73), Dst: Sagemcom_7e:6c:ee (84:a4:23:7e:6c:ee)
    Destination: Sagemcom_7e:6c:ee (84:a4:23:7e:6c:ee)
    Source: Apple_1d:4a:73 (a0:99:9b:1d:4a:73)
    Type: IPv4 (0x0800)
Internet Protocol Version 4, Src: 192.168.1.44, Dst: 31.13.92.10
Transmission Control Protocol, Src Port: 59313, Dst Port: 443, Seq: 890, Ack: 577, Len: 0

No.     Time           Source                Destination           Protocol Length Info
     15 3.510870       31.13.92.10           192.168.1.44          TLSv1.2  312    Application Data

Frame 15: 312 bytes on wire (2496 bits), 312 bytes captured (2496 bits) on interface 0
Ethernet II, Src: Sagemcom_7e:6c:ee (84:a4:23:7e:6c:ee), Dst: Apple_1d:4a:73 (a0:99:9b:1d:4a:73)
    Destination: Apple_1d:4a:73 (a0:99:9b:1d:4a:73)
    Source: Sagemcom_7e:6c:ee (84:a4:23:7e:6c:ee)
    Type: IPv4 (0x0800)
Internet Protocol Version 4, Src: 31.13.92.10, Dst: 192.168.1.44
Transmission Control Protocol, Src Port: 443, Dst Port: 59313, Seq: 577, Ack: 890, Len: 246
Secure Sockets Layer
    TLSv1.2 Record Layer: Application Data Protocol: http-over-tls
        Content Type: Application Data (23)
        Version: TLS 1.2 (0x0303)
        Length: 241
        Encrypted Application Data: 6b6adfb71475e03d25fb65e5ea7353d9992587f2488792a1...

No.     Time           Source                Destination           Protocol Length Info
     16 3.510919       192.168.1.44          31.13.92.10           TCP      66     59313→443 [ACK] Seq=890 Ack=823 Win=4088 Len=0 TSval=862808826 TSecr=1871690319

Frame 16: 66 bytes on wire (528 bits), 66 bytes captured (528 bits) on interface 0
Ethernet II, Src: Apple_1d:4a:73 (a0:99:9b:1d:4a:73), Dst: Sagemcom_7e:6c:ee (84:a4:23:7e:6c:ee)
    Destination: Sagemcom_7e:6c:ee (84:a4:23:7e:6c:ee)
    Source: Apple_1d:4a:73 (a0:99:9b:1d:4a:73)
    Type: IPv4 (0x0800)
Internet Protocol Version 4, Src: 192.168.1.44, Dst: 31.13.92.10
Transmission Control Protocol, Src Port: 59313, Dst Port: 443, Seq: 890, Ack: 823, Len: 0

No.     Time           Source                Destination           Protocol Length Info
     17 3.515825       192.168.1.44          31.13.92.10           TLSv1.2  510    Application Data

Frame 17: 510 bytes on wire (4080 bits), 510 bytes captured (4080 bits) on interface 0
Ethernet II, Src: Apple_1d:4a:73 (a0:99:9b:1d:4a:73), Dst: Sagemcom_7e:6c:ee (84:a4:23:7e:6c:ee)
    Destination: Sagemcom_7e:6c:ee (84:a4:23:7e:6c:ee)
    Source: Apple_1d:4a:73 (a0:99:9b:1d:4a:73)
    Type: IPv4 (0x0800)
Internet Protocol Version 4, Src: 192.168.1.44, Dst: 31.13.92.10
Transmission Control Protocol, Src Port: 59313, Dst Port: 443, Seq: 890, Ack: 823, Len: 444
Secure Sockets Layer
    TLSv1.2 Record Layer: Application Data Protocol: http-over-tls
        Content Type: Application Data (23)
        Version: TLS 1.2 (0x0303)
        Length: 439
        Encrypted Application Data: 4acf3b33cd586cc5417362a8adf9ec002f1ab156c4037b79...

No.     Time           Source                Destination           Protocol Length Info
     18 3.548897       31.13.92.10           192.168.1.44          TLSv1.2  108    Application Data

Frame 18: 108 bytes on wire (864 bits), 108 bytes captured (864 bits) on interface 0
Ethernet II, Src: Sagemcom_7e:6c:ee (84:a4:23:7e:6c:ee), Dst: Apple_1d:4a:73 (a0:99:9b:1d:4a:73)
    Destination: Apple_1d:4a:73 (a0:99:9b:1d:4a:73)
    Source: Sagemcom_7e:6c:ee (84:a4:23:7e:6c:ee)
    Type: IPv4 (0x0800)
Internet Protocol Version 4, Src: 31.13.92.10, Dst: 192.168.1.44
Transmission Control Protocol, Src Port: 443, Dst Port: 59313, Seq: 823, Ack: 1334, Len: 42
Secure Sockets Layer
    TLSv1.2 Record Layer: Application Data Protocol: http-over-tls
        Content Type: Application Data (23)
        Version: TLS 1.2 (0x0303)
        Length: 37
        Encrypted Application Data: 6b6adfb71475e03edf172cddfca6d4319ee5064e00a21888...

No.     Time           Source                Destination           Protocol Length Info
     19 3.548989       192.168.1.44          31.13.92.10           TCP      66     59313→443 [ACK] Seq=1334 Ack=865 Win=4094 Len=0 TSval=862808863 TSecr=1871690356

Frame 19: 66 bytes on wire (528 bits), 66 bytes captured (528 bits) on interface 0
Ethernet II, Src: Apple_1d:4a:73 (a0:99:9b:1d:4a:73), Dst: Sagemcom_7e:6c:ee (84:a4:23:7e:6c:ee)
    Destination: Sagemcom_7e:6c:ee (84:a4:23:7e:6c:ee)
    Source: Apple_1d:4a:73 (a0:99:9b:1d:4a:73)
    Type: IPv4 (0x0800)
Internet Protocol Version 4, Src: 192.168.1.44, Dst: 31.13.92.10
Transmission Control Protocol, Src Port: 59313, Dst Port: 443, Seq: 1334, Ack: 865, Len: 0

No.     Time           Source                Destination           Protocol Length Info
     20 6.609055       192.168.1.44          54.239.192.53         TCP      54     59912→80 [ACK] Seq=1 Ack=1 Win=4101 Len=0

Frame 20: 54 bytes on wire (432 bits), 54 bytes captured (432 bits) on interface 0
Ethernet II, Src: Apple_1d:4a:73 (a0:99:9b:1d:4a:73), Dst: Sagemcom_7e:6c:ee (84:a4:23:7e:6c:ee)
    Destination: Sagemcom_7e:6c:ee (84:a4:23:7e:6c:ee)
    Source: Apple_1d:4a:73 (a0:99:9b:1d:4a:73)
    Type: IPv4 (0x0800)
Internet Protocol Version 4, Src: 192.168.1.44, Dst: 54.239.192.53
Transmission Control Protocol, Src Port: 59912, Dst Port: 80, Seq: 1, Ack: 1, Len: 0

No.     Time           Source                Destination           Protocol Length Info
     21 6.633939       54.239.192.53         192.168.1.44          TCP      66     [TCP ACKed unseen segment] 80→59912 [ACK] Seq=1 Ack=2 Win=118 Len=0 TSval=2331608691 TSecr=862751767

Frame 21: 66 bytes on wire (528 bits), 66 bytes captured (528 bits) on interface 0
Ethernet II, Src: Sagemcom_7e:6c:ee (84:a4:23:7e:6c:ee), Dst: Apple_1d:4a:73 (a0:99:9b:1d:4a:73)
    Destination: Apple_1d:4a:73 (a0:99:9b:1d:4a:73)
    Source: Sagemcom_7e:6c:ee (84:a4:23:7e:6c:ee)
    Type: IPv4 (0x0800)
Internet Protocol Version 4, Src: 54.239.192.53, Dst: 192.168.1.44
Transmission Control Protocol, Src Port: 80, Dst Port: 59912, Seq: 1, Ack: 2, Len: 0

No.     Time           Source                Destination           Protocol Length Info
     22 9.422533       162.125.18.133        192.168.1.44          TLSv1.2  323    Application Data

Frame 22: 323 bytes on wire (2584 bits), 323 bytes captured (2584 bits) on interface 0
Ethernet II, Src: Sagemcom_7e:6c:ee (84:a4:23:7e:6c:ee), Dst: Apple_1d:4a:73 (a0:99:9b:1d:4a:73)
    Destination: Apple_1d:4a:73 (a0:99:9b:1d:4a:73)
    Source: Sagemcom_7e:6c:ee (84:a4:23:7e:6c:ee)
    Type: IPv4 (0x0800)
Internet Protocol Version 4, Src: 162.125.18.133, Dst: 192.168.1.44
Transmission Control Protocol, Src Port: 443, Dst Port: 59260, Seq: 1, Ack: 1, Len: 257
Secure Sockets Layer
    TLSv1.2 Record Layer: Application Data Protocol: http-over-tls
        Content Type: Application Data (23)
        Version: TLS 1.2 (0x0303)
        Length: 252
        Encrypted Application Data: 1fa0705d91345ce40077e94bde68fdc0bd3501b5be6e03a6...

No.     Time           Source                Destination           Protocol Length Info
     23 9.422631       192.168.1.44          162.125.18.133        TCP      66     59260→443 [ACK] Seq=1 Ack=258 Win=4087 Len=0 TSval=862814732 TSecr=1352364289

Frame 23: 66 bytes on wire (528 bits), 66 bytes captured (528 bits) on interface 0
Ethernet II, Src: Apple_1d:4a:73 (a0:99:9b:1d:4a:73), Dst: Sagemcom_7e:6c:ee (84:a4:23:7e:6c:ee)
    Destination: Sagemcom_7e:6c:ee (84:a4:23:7e:6c:ee)
    Source: Apple_1d:4a:73 (a0:99:9b:1d:4a:73)
    Type: IPv4 (0x0800)
Internet Protocol Version 4, Src: 192.168.1.44, Dst: 162.125.18.133
Transmission Control Protocol, Src Port: 59260, Dst Port: 443, Seq: 1, Ack: 258, Len: 0

No.     Time           Source                Destination           Protocol Length Info
     24 9.422909       162.125.18.133        192.168.1.44          TLSv1.2  323    [TCP Spurious Retransmission] Application Data

Frame 24: 323 bytes on wire (2584 bits), 323 bytes captured (2584 bits) on interface 0
Ethernet II, Src: Sagemcom_7e:6c:ee (84:a4:23:7e:6c:ee), Dst: Apple_1d:4a:73 (a0:99:9b:1d:4a:73)
    Destination: Apple_1d:4a:73 (a0:99:9b:1d:4a:73)
    Source: Sagemcom_7e:6c:ee (84:a4:23:7e:6c:ee)
    Type: IPv4 (0x0800)
Internet Protocol Version 4, Src: 162.125.18.133, Dst: 192.168.1.44
Transmission Control Protocol, Src Port: 443, Dst Port: 59260, Seq: 1, Ack: 1, Len: 257
Secure Sockets Layer
    TLSv1.2 Record Layer: Application Data Protocol: http-over-tls
        Content Type: Application Data (23)
        Version: TLS 1.2 (0x0303)
        Length: 252
        Encrypted Application Data: 1fa0705d91345ce40077e94bde68fdc0bd3501b5be6e03a6...

No.     Time           Source                Destination           Protocol Length Info
     25 9.422986       192.168.1.44          162.125.18.133        TCP      78     [TCP Dup ACK 23#1] 59260→443 [ACK] Seq=1 Ack=258 Win=4087 Len=0 TSval=862814732 TSecr=1352364468 SLE=1 SRE=258

Frame 25: 78 bytes on wire (624 bits), 78 bytes captured (624 bits) on interface 0
Ethernet II, Src: Apple_1d:4a:73 (a0:99:9b:1d:4a:73), Dst: Sagemcom_7e:6c:ee (84:a4:23:7e:6c:ee)
    Destination: Sagemcom_7e:6c:ee (84:a4:23:7e:6c:ee)
    Source: Apple_1d:4a:73 (a0:99:9b:1d:4a:73)
    Type: IPv4 (0x0800)
Internet Protocol Version 4, Src: 192.168.1.44, Dst: 162.125.18.133
Transmission Control Protocol, Src Port: 59260, Dst Port: 443, Seq: 1, Ack: 258, Len: 0

No.     Time           Source                Destination           Protocol Length Info
     26 9.427212       192.168.1.44          162.125.18.133        TCP      1494   [TCP segment of a reassembled PDU]

Frame 26: 1494 bytes on wire (11952 bits), 1494 bytes captured (11952 bits) on interface 0
Ethernet II, Src: Apple_1d:4a:73 (a0:99:9b:1d:4a:73), Dst: Sagemcom_7e:6c:ee (84:a4:23:7e:6c:ee)
    Destination: Sagemcom_7e:6c:ee (84:a4:23:7e:6c:ee)
    Source: Apple_1d:4a:73 (a0:99:9b:1d:4a:73)
    Type: IPv4 (0x0800)
Internet Protocol Version 4, Src: 192.168.1.44, Dst: 162.125.18.133
Transmission Control Protocol, Src Port: 59260, Dst Port: 443, Seq: 1, Ack: 258, Len: 1428

No.     Time           Source                Destination           Protocol Length Info
     27 9.427213       192.168.1.44          162.125.18.133        TLSv1.2  239    Application Data

Frame 27: 239 bytes on wire (1912 bits), 239 bytes captured (1912 bits) on interface 0
Ethernet II, Src: Apple_1d:4a:73 (a0:99:9b:1d:4a:73), Dst: Sagemcom_7e:6c:ee (84:a4:23:7e:6c:ee)
    Destination: Sagemcom_7e:6c:ee (84:a4:23:7e:6c:ee)
    Source: Apple_1d:4a:73 (a0:99:9b:1d:4a:73)
    Type: IPv4 (0x0800)
Internet Protocol Version 4, Src: 192.168.1.44, Dst: 162.125.18.133
Transmission Control Protocol, Src Port: 59260, Dst Port: 443, Seq: 1429, Ack: 258, Len: 173
[2 Reassembled TCP Segments (1601 bytes): #26(1428), #27(173)]
Secure Sockets Layer
    TLSv1.2 Record Layer: Application Data Protocol: http-over-tls
        Content Type: Application Data (23)
        Version: TLS 1.2 (0x0303)
        Length: 1596
        Encrypted Application Data: ccede5fe6f812f531fcb25f48be4051a5718b916d5c2b2d5...

No.     Time           Source                Destination           Protocol Length Info
     28 9.582151       162.125.18.133        192.168.1.44          TCP      66     443→59260 [ACK] Seq=258 Ack=1429 Win=360 Len=0 TSval=1352364538 TSecr=862814736

Frame 28: 66 bytes on wire (528 bits), 66 bytes captured (528 bits) on interface 0
Ethernet II, Src: Sagemcom_7e:6c:ee (84:a4:23:7e:6c:ee), Dst: Apple_1d:4a:73 (a0:99:9b:1d:4a:73)
    Destination: Apple_1d:4a:73 (a0:99:9b:1d:4a:73)
    Source: Sagemcom_7e:6c:ee (84:a4:23:7e:6c:ee)
    Type: IPv4 (0x0800)
Internet Protocol Version 4, Src: 162.125.18.133, Dst: 192.168.1.44
Transmission Control Protocol, Src Port: 443, Dst Port: 59260, Seq: 258, Ack: 1429, Len: 0

No.     Time           Source                Destination           Protocol Length Info
     29 9.585434       162.125.18.133        192.168.1.44          TCP      66     443→59260 [ACK] Seq=258 Ack=1602 Win=360 Len=0 TSval=1352364538 TSecr=862814736

Frame 29: 66 bytes on wire (528 bits), 66 bytes captured (528 bits) on interface 0
Ethernet II, Src: Sagemcom_7e:6c:ee (84:a4:23:7e:6c:ee), Dst: Apple_1d:4a:73 (a0:99:9b:1d:4a:73)
    Destination: Apple_1d:4a:73 (a0:99:9b:1d:4a:73)
    Source: Sagemcom_7e:6c:ee (84:a4:23:7e:6c:ee)
    Type: IPv4 (0x0800)
Internet Protocol Version 4, Src: 162.125.18.133, Dst: 192.168.1.44
Transmission Control Protocol, Src Port: 443, Dst Port: 59260, Seq: 258, Ack: 1602, Len: 0

No.     Time           Source                Destination           Protocol Length Info
     30 10.446969      192.168.1.57          224.0.0.251           IGMPv2   46     Membership Report group 224.0.0.251

Frame 30: 46 bytes on wire (368 bits), 46 bytes captured (368 bits) on interface 0
Ethernet II, Src: Azurewav_27:b3:af (24:0a:64:27:b3:af), Dst: IPv4mcast_fb (01:00:5e:00:00:fb)
    Destination: IPv4mcast_fb (01:00:5e:00:00:fb)
    Source: Azurewav_27:b3:af (24:0a:64:27:b3:af)
    Type: IPv4 (0x0800)
Internet Protocol Version 4, Src: 192.168.1.57, Dst: 224.0.0.251
Internet Group Management Protocol

No.     Time           Source                Destination           Protocol Length Info
     31 11.140412      192.168.1.44          131.253.14.227        TCP      78     59920→443 [SYN] Seq=0 Win=65535 Len=0 MSS=1460 WS=32 TSval=862816443 TSecr=0 SACK_PERM=1

Frame 31: 78 bytes on wire (624 bits), 78 bytes captured (624 bits) on interface 0
Ethernet II, Src: Apple_1d:4a:73 (a0:99:9b:1d:4a:73), Dst: Sagemcom_7e:6c:ee (84:a4:23:7e:6c:ee)
    Destination: Sagemcom_7e:6c:ee (84:a4:23:7e:6c:ee)
    Source: Apple_1d:4a:73 (a0:99:9b:1d:4a:73)
    Type: IPv4 (0x0800)
Internet Protocol Version 4, Src: 192.168.1.44, Dst: 131.253.14.227
Transmission Control Protocol, Src Port: 59920, Dst Port: 443, Seq: 0, Len: 0

No.     Time           Source                Destination           Protocol Length Info
     32 11.266872      131.253.14.227        192.168.1.44          TCP      74     443→59920 [SYN, ACK] Seq=0 Ack=1 Win=8192 Len=0 MSS=1440 WS=256 SACK_PERM=1 TSval=121018697 TSecr=862816443

Frame 32: 74 bytes on wire (592 bits), 74 bytes captured (592 bits) on interface 0
Ethernet II, Src: Sagemcom_7e:6c:ee (84:a4:23:7e:6c:ee), Dst: Apple_1d:4a:73 (a0:99:9b:1d:4a:73)
    Destination: Apple_1d:4a:73 (a0:99:9b:1d:4a:73)
    Source: Sagemcom_7e:6c:ee (84:a4:23:7e:6c:ee)
    Type: IPv4 (0x0800)
Internet Protocol Version 4, Src: 131.253.14.227, Dst: 192.168.1.44
Transmission Control Protocol, Src Port: 443, Dst Port: 59920, Seq: 0, Ack: 1, Len: 0

No.     Time           Source                Destination           Protocol Length Info
     33 11.266969      192.168.1.44          131.253.14.227        TCP      66     59920→443 [ACK] Seq=1 Ack=1 Win=131360 Len=0 TSval=862816569 TSecr=121018697

Frame 33: 66 bytes on wire (528 bits), 66 bytes captured (528 bits) on interface 0
Ethernet II, Src: Apple_1d:4a:73 (a0:99:9b:1d:4a:73), Dst: Sagemcom_7e:6c:ee (84:a4:23:7e:6c:ee)
    Destination: Sagemcom_7e:6c:ee (84:a4:23:7e:6c:ee)
    Source: Apple_1d:4a:73 (a0:99:9b:1d:4a:73)
    Type: IPv4 (0x0800)
Internet Protocol Version 4, Src: 192.168.1.44, Dst: 131.253.14.227
Transmission Control Protocol, Src Port: 59920, Dst Port: 443, Seq: 1, Ack: 1, Len: 0

No.     Time           Source                Destination           Protocol Length Info
     34 11.267778      192.168.1.44          131.253.14.227        TLSv1.2  273    Client Hello

Frame 34: 273 bytes on wire (2184 bits), 273 bytes captured (2184 bits) on interface 0
Ethernet II, Src: Apple_1d:4a:73 (a0:99:9b:1d:4a:73), Dst: Sagemcom_7e:6c:ee (84:a4:23:7e:6c:ee)
    Destination: Sagemcom_7e:6c:ee (84:a4:23:7e:6c:ee)
    Source: Apple_1d:4a:73 (a0:99:9b:1d:4a:73)
    Type: IPv4 (0x0800)
Internet Protocol Version 4, Src: 192.168.1.44, Dst: 131.253.14.227
Transmission Control Protocol, Src Port: 59920, Dst Port: 443, Seq: 1, Ack: 1, Len: 207
Secure Sockets Layer
    TLSv1.2 Record Layer: Handshake Protocol: Client Hello
        Content Type: Handshake (22)
        Version: TLS 1.0 (0x0301)
        Length: 202
        Handshake Protocol: Client Hello

No.     Time           Source                Destination           Protocol Length Info
     35 11.398190      131.253.14.227        192.168.1.44          TCP      1514   [TCP segment of a reassembled PDU]

Frame 35: 1514 bytes on wire (12112 bits), 1514 bytes captured (12112 bits) on interface 0
Ethernet II, Src: Sagemcom_7e:6c:ee (84:a4:23:7e:6c:ee), Dst: Apple_1d:4a:73 (a0:99:9b:1d:4a:73)
    Destination: Apple_1d:4a:73 (a0:99:9b:1d:4a:73)
    Source: Sagemcom_7e:6c:ee (84:a4:23:7e:6c:ee)
    Type: IPv4 (0x0800)
Internet Protocol Version 4, Src: 131.253.14.227, Dst: 192.168.1.44
Transmission Control Protocol, Src Port: 443, Dst Port: 59920, Seq: 1, Ack: 208, Len: 1448

No.     Time           Source                Destination           Protocol Length Info
     36 11.399014      131.253.14.227        192.168.1.44          TCP      1514   [TCP segment of a reassembled PDU]

Frame 36: 1514 bytes on wire (12112 bits), 1514 bytes captured (12112 bits) on interface 0
Ethernet II, Src: Sagemcom_7e:6c:ee (84:a4:23:7e:6c:ee), Dst: Apple_1d:4a:73 (a0:99:9b:1d:4a:73)
    Destination: Apple_1d:4a:73 (a0:99:9b:1d:4a:73)
    Source: Sagemcom_7e:6c:ee (84:a4:23:7e:6c:ee)
    Type: IPv4 (0x0800)
Internet Protocol Version 4, Src: 131.253.14.227, Dst: 192.168.1.44
Transmission Control Protocol, Src Port: 443, Dst Port: 59920, Seq: 1449, Ack: 208, Len: 1448

No.     Time           Source                Destination           Protocol Length Info
     37 11.399021      131.253.14.227        192.168.1.44          TCP      1514   [TCP segment of a reassembled PDU]

Frame 37: 1514 bytes on wire (12112 bits), 1514 bytes captured (12112 bits) on interface 0
Ethernet II, Src: Sagemcom_7e:6c:ee (84:a4:23:7e:6c:ee), Dst: Apple_1d:4a:73 (a0:99:9b:1d:4a:73)
    Destination: Apple_1d:4a:73 (a0:99:9b:1d:4a:73)
    Source: Sagemcom_7e:6c:ee (84:a4:23:7e:6c:ee)
    Type: IPv4 (0x0800)
Internet Protocol Version 4, Src: 131.253.14.227, Dst: 192.168.1.44
Transmission Control Protocol, Src Port: 443, Dst Port: 59920, Seq: 2897, Ack: 208, Len: 1448

No.     Time           Source                Destination           Protocol Length Info
     38 11.399106      192.168.1.44          131.253.14.227        TCP      66     59920→443 [ACK] Seq=208 Ack=2897 Win=129600 Len=0 TSval=862816699 TSecr=121018709

Frame 38: 66 bytes on wire (528 bits), 66 bytes captured (528 bits) on interface 0
Ethernet II, Src: Apple_1d:4a:73 (a0:99:9b:1d:4a:73), Dst: Sagemcom_7e:6c:ee (84:a4:23:7e:6c:ee)
    Destination: Sagemcom_7e:6c:ee (84:a4:23:7e:6c:ee)
    Source: Apple_1d:4a:73 (a0:99:9b:1d:4a:73)
    Type: IPv4 (0x0800)
Internet Protocol Version 4, Src: 192.168.1.44, Dst: 131.253.14.227
Transmission Control Protocol, Src Port: 59920, Dst Port: 443, Seq: 208, Ack: 2897, Len: 0

No.     Time           Source                Destination           Protocol Length Info
     39 11.399257      192.168.1.44          131.253.14.227        TCP      66     59920→443 [ACK] Seq=208 Ack=4345 Win=131072 Len=0 TSval=862816699 TSecr=121018709

Frame 39: 66 bytes on wire (528 bits), 66 bytes captured (528 bits) on interface 0
Ethernet II, Src: Apple_1d:4a:73 (a0:99:9b:1d:4a:73), Dst: Sagemcom_7e:6c:ee (84:a4:23:7e:6c:ee)
    Destination: Sagemcom_7e:6c:ee (84:a4:23:7e:6c:ee)
    Source: Apple_1d:4a:73 (a0:99:9b:1d:4a:73)
    Type: IPv4 (0x0800)
Internet Protocol Version 4, Src: 192.168.1.44, Dst: 131.253.14.227
Transmission Control Protocol, Src Port: 59920, Dst Port: 443, Seq: 208, Ack: 4345, Len: 0

No.     Time           Source                Destination           Protocol Length Info
     40 11.417784      131.253.14.227        192.168.1.44          TCP      1514   [TCP segment of a reassembled PDU]

Frame 40: 1514 bytes on wire (12112 bits), 1514 bytes captured (12112 bits) on interface 0
Ethernet II, Src: Sagemcom_7e:6c:ee (84:a4:23:7e:6c:ee), Dst: Apple_1d:4a:73 (a0:99:9b:1d:4a:73)
    Destination: Apple_1d:4a:73 (a0:99:9b:1d:4a:73)
    Source: Sagemcom_7e:6c:ee (84:a4:23:7e:6c:ee)
    Type: IPv4 (0x0800)
Internet Protocol Version 4, Src: 131.253.14.227, Dst: 192.168.1.44
Transmission Control Protocol, Src Port: 443, Dst Port: 59920, Seq: 4345, Ack: 208, Len: 1448

No.     Time           Source                Destination           Protocol Length Info
     41 11.519591      192.168.1.44          131.253.14.227        TCP      66     59920→443 [ACK] Seq=208 Ack=5793 Win=131072 Len=0 TSval=862816819 TSecr=121018709

Frame 41: 66 bytes on wire (528 bits), 66 bytes captured (528 bits) on interface 0
Ethernet II, Src: Apple_1d:4a:73 (a0:99:9b:1d:4a:73), Dst: Sagemcom_7e:6c:ee (84:a4:23:7e:6c:ee)
    Destination: Sagemcom_7e:6c:ee (84:a4:23:7e:6c:ee)
    Source: Apple_1d:4a:73 (a0:99:9b:1d:4a:73)
    Type: IPv4 (0x0800)
Internet Protocol Version 4, Src: 192.168.1.44, Dst: 131.253.14.227
Transmission Control Protocol, Src Port: 59920, Dst Port: 443, Seq: 208, Ack: 5793, Len: 0

No.     Time           Source                Destination           Protocol Length Info
     42 11.551946      131.253.14.227        192.168.1.44          TCP      1514   [TCP segment of a reassembled PDU]

Frame 42: 1514 bytes on wire (12112 bits), 1514 bytes captured (12112 bits) on interface 0
Ethernet II, Src: Sagemcom_7e:6c:ee (84:a4:23:7e:6c:ee), Dst: Apple_1d:4a:73 (a0:99:9b:1d:4a:73)
    Destination: Apple_1d:4a:73 (a0:99:9b:1d:4a:73)
    Source: Sagemcom_7e:6c:ee (84:a4:23:7e:6c:ee)
    Type: IPv4 (0x0800)
Internet Protocol Version 4, Src: 131.253.14.227, Dst: 192.168.1.44
Transmission Control Protocol, Src Port: 443, Dst Port: 59920, Seq: 5793, Ack: 208, Len: 1448

No.     Time           Source                Destination           Protocol Length Info
     43 11.574966      131.253.14.227        192.168.1.44          TLSv1.2  1413   Server Hello, Certificate, Certificate Status, Server Key Exchange, Server Hello Done

Frame 43: 1413 bytes on wire (11304 bits), 1413 bytes captured (11304 bits) on interface 0
Ethernet II, Src: Sagemcom_7e:6c:ee (84:a4:23:7e:6c:ee), Dst: Apple_1d:4a:73 (a0:99:9b:1d:4a:73)
    Destination: Apple_1d:4a:73 (a0:99:9b:1d:4a:73)
    Source: Sagemcom_7e:6c:ee (84:a4:23:7e:6c:ee)
    Type: IPv4 (0x0800)
Internet Protocol Version 4, Src: 131.253.14.227, Dst: 192.168.1.44
Transmission Control Protocol, Src Port: 443, Dst Port: 59920, Seq: 7241, Ack: 208, Len: 1347
[6 Reassembled TCP Segments (8587 bytes): #35(1448), #36(1448), #37(1448), #40(1448), #42(1448), #43(1347)]
Secure Sockets Layer
    TLSv1.2 Record Layer: Handshake Protocol: Multiple Handshake Messages
        Content Type: Handshake (22)
        Version: TLS 1.2 (0x0303)
        Length: 8582
        Handshake Protocol: Server Hello
        Handshake Protocol: Certificate
        Handshake Protocol: Certificate Status
        Handshake Protocol: Server Key Exchange
        Handshake Protocol: Server Hello Done

No.     Time           Source                Destination           Protocol Length Info
     44 11.575051      192.168.1.44          131.253.14.227        TCP      66     59920→443 [ACK] Seq=208 Ack=8588 Win=129696 Len=0 TSval=862816874 TSecr=121018726

Frame 44: 66 bytes on wire (528 bits), 66 bytes captured (528 bits) on interface 0
Ethernet II, Src: Apple_1d:4a:73 (a0:99:9b:1d:4a:73), Dst: Sagemcom_7e:6c:ee (84:a4:23:7e:6c:ee)
    Destination: Sagemcom_7e:6c:ee (84:a4:23:7e:6c:ee)
    Source: Apple_1d:4a:73 (a0:99:9b:1d:4a:73)
    Type: IPv4 (0x0800)
Internet Protocol Version 4, Src: 192.168.1.44, Dst: 131.253.14.227
Transmission Control Protocol, Src Port: 59920, Dst Port: 443, Seq: 208, Ack: 8588, Len: 0

No.     Time           Source                Destination           Protocol Length Info
     45 11.591096      192.168.1.44          131.253.14.227        TLSv1.2  173    Client Key Exchange

Frame 45: 173 bytes on wire (1384 bits), 173 bytes captured (1384 bits) on interface 0
Ethernet II, Src: Apple_1d:4a:73 (a0:99:9b:1d:4a:73), Dst: Sagemcom_7e:6c:ee (84:a4:23:7e:6c:ee)
    Destination: Sagemcom_7e:6c:ee (84:a4:23:7e:6c:ee)
    Source: Apple_1d:4a:73 (a0:99:9b:1d:4a:73)
    Type: IPv4 (0x0800)
Internet Protocol Version 4, Src: 192.168.1.44, Dst: 131.253.14.227
Transmission Control Protocol, Src Port: 59920, Dst Port: 443, Seq: 208, Ack: 8588, Len: 107
Secure Sockets Layer
    TLSv1.2 Record Layer: Handshake Protocol: Client Key Exchange
        Content Type: Handshake (22)
        Version: TLS 1.2 (0x0303)
        Length: 102
        Handshake Protocol: Client Key Exchange

No.     Time           Source                Destination           Protocol Length Info
     46 11.591097      192.168.1.44          131.253.14.227        TLSv1.2  72     Change Cipher Spec

Frame 46: 72 bytes on wire (576 bits), 72 bytes captured (576 bits) on interface 0
Ethernet II, Src: Apple_1d:4a:73 (a0:99:9b:1d:4a:73), Dst: Sagemcom_7e:6c:ee (84:a4:23:7e:6c:ee)
    Destination: Sagemcom_7e:6c:ee (84:a4:23:7e:6c:ee)
    Source: Apple_1d:4a:73 (a0:99:9b:1d:4a:73)
    Type: IPv4 (0x0800)
Internet Protocol Version 4, Src: 192.168.1.44, Dst: 131.253.14.227
Transmission Control Protocol, Src Port: 59920, Dst Port: 443, Seq: 315, Ack: 8588, Len: 6
Secure Sockets Layer
    TLSv1.2 Record Layer: Change Cipher Spec Protocol: Change Cipher Spec
        Content Type: Change Cipher Spec (20)
        Version: TLS 1.2 (0x0303)
        Length: 1
        Change Cipher Spec Message

No.     Time           Source                Destination           Protocol Length Info
     47 11.591098      192.168.1.44          131.253.14.227        TLSv1.2  167    Encrypted Handshake Message

Frame 47: 167 bytes on wire (1336 bits), 167 bytes captured (1336 bits) on interface 0
Ethernet II, Src: Apple_1d:4a:73 (a0:99:9b:1d:4a:73), Dst: Sagemcom_7e:6c:ee (84:a4:23:7e:6c:ee)
    Destination: Sagemcom_7e:6c:ee (84:a4:23:7e:6c:ee)
    Source: Apple_1d:4a:73 (a0:99:9b:1d:4a:73)
    Type: IPv4 (0x0800)
Internet Protocol Version 4, Src: 192.168.1.44, Dst: 131.253.14.227
Transmission Control Protocol, Src Port: 59920, Dst Port: 443, Seq: 321, Ack: 8588, Len: 101
Secure Sockets Layer
    TLSv1.2 Record Layer: Handshake Protocol: Encrypted Handshake Message
        Content Type: Handshake (22)
        Version: TLS 1.2 (0x0303)
        Length: 96
        Handshake Protocol: Encrypted Handshake Message

No.     Time           Source                Destination           Protocol Length Info
     48 11.760130      131.253.14.227        192.168.1.44          TCP      66     443→59920 [ACK] Seq=8588 Ack=321 Win=131584 Len=0 TSval=121018746 TSecr=862816890

Frame 48: 66 bytes on wire (528 bits), 66 bytes captured (528 bits) on interface 0
Ethernet II, Src: Sagemcom_7e:6c:ee (84:a4:23:7e:6c:ee), Dst: Apple_1d:4a:73 (a0:99:9b:1d:4a:73)
    Destination: Apple_1d:4a:73 (a0:99:9b:1d:4a:73)
    Source: Sagemcom_7e:6c:ee (84:a4:23:7e:6c:ee)
    Type: IPv4 (0x0800)
Internet Protocol Version 4, Src: 131.253.14.227, Dst: 192.168.1.44
Transmission Control Protocol, Src Port: 443, Dst Port: 59920, Seq: 8588, Ack: 321, Len: 0

No.     Time           Source                Destination           Protocol Length Info
     49 11.761513      131.253.14.227        192.168.1.44          TLSv1.2  173    Change Cipher Spec, Encrypted Handshake Message

Frame 49: 173 bytes on wire (1384 bits), 173 bytes captured (1384 bits) on interface 0
Ethernet II, Src: Sagemcom_7e:6c:ee (84:a4:23:7e:6c:ee), Dst: Apple_1d:4a:73 (a0:99:9b:1d:4a:73)
    Destination: Apple_1d:4a:73 (a0:99:9b:1d:4a:73)
    Source: Sagemcom_7e:6c:ee (84:a4:23:7e:6c:ee)
    Type: IPv4 (0x0800)
Internet Protocol Version 4, Src: 131.253.14.227, Dst: 192.168.1.44
Transmission Control Protocol, Src Port: 443, Dst Port: 59920, Seq: 8588, Ack: 422, Len: 107
Secure Sockets Layer
    TLSv1.2 Record Layer: Change Cipher Spec Protocol: Change Cipher Spec
        Content Type: Change Cipher Spec (20)
        Version: TLS 1.2 (0x0303)
        Length: 1
        Change Cipher Spec Message
    TLSv1.2 Record Layer: Handshake Protocol: Encrypted Handshake Message
        Content Type: Handshake (22)
        Version: TLS 1.2 (0x0303)
        Length: 96
        Handshake Protocol: Encrypted Handshake Message

No.     Time           Source                Destination           Protocol Length Info
     50 11.761606      192.168.1.44          131.253.14.227        TCP      66     59920→443 [ACK] Seq=422 Ack=8695 Win=130944 Len=0 TSval=862817059 TSecr=121018747

Frame 50: 66 bytes on wire (528 bits), 66 bytes captured (528 bits) on interface 0
Ethernet II, Src: Apple_1d:4a:73 (a0:99:9b:1d:4a:73), Dst: Sagemcom_7e:6c:ee (84:a4:23:7e:6c:ee)
    Destination: Sagemcom_7e:6c:ee (84:a4:23:7e:6c:ee)
    Source: Apple_1d:4a:73 (a0:99:9b:1d:4a:73)
    Type: IPv4 (0x0800)
Internet Protocol Version 4, Src: 192.168.1.44, Dst: 131.253.14.227
Transmission Control Protocol, Src Port: 59920, Dst Port: 443, Seq: 422, Ack: 8695, Len: 0

No.     Time           Source                Destination           Protocol Length Info
     51 11.762088      192.168.1.44          131.253.14.227        TCP      1494   [TCP segment of a reassembled PDU]

Frame 51: 1494 bytes on wire (11952 bits), 1494 bytes captured (11952 bits) on interface 0
Ethernet II, Src: Apple_1d:4a:73 (a0:99:9b:1d:4a:73), Dst: Sagemcom_7e:6c:ee (84:a4:23:7e:6c:ee)
    Destination: Sagemcom_7e:6c:ee (84:a4:23:7e:6c:ee)
    Source: Apple_1d:4a:73 (a0:99:9b:1d:4a:73)
    Type: IPv4 (0x0800)
Internet Protocol Version 4, Src: 192.168.1.44, Dst: 131.253.14.227
Transmission Control Protocol, Src Port: 59920, Dst Port: 443, Seq: 422, Ack: 8695, Len: 1428

No.     Time           Source                Destination           Protocol Length Info
     52 11.762089      192.168.1.44          131.253.14.227        TCP      1494   [TCP segment of a reassembled PDU]

Frame 52: 1494 bytes on wire (11952 bits), 1494 bytes captured (11952 bits) on interface 0
Ethernet II, Src: Apple_1d:4a:73 (a0:99:9b:1d:4a:73), Dst: Sagemcom_7e:6c:ee (84:a4:23:7e:6c:ee)
    Destination: Sagemcom_7e:6c:ee (84:a4:23:7e:6c:ee)
    Source: Apple_1d:4a:73 (a0:99:9b:1d:4a:73)
    Type: IPv4 (0x0800)
Internet Protocol Version 4, Src: 192.168.1.44, Dst: 131.253.14.227
